id,gender,masterCategory,subCategory,articleType,baseColour,season,year,usage,productDisplayName,
57163,Women,Apparel,Topwear,Tshirts,Pink,Summer,2012,Casual,Elle Women Dark Pink Essentials T-shirt,
25543,Women,Apparel,Topwear,Tops,Pink,Summer,2012,Casual,Wrangler Women Striper Tank Pink Top,
11776,Men,Apparel,Topwear,Tshirts,Grey,Fall,2011,Casual,Lee Men Printed Grey Tshirts,
41006,Girls,Apparel,Bottomwear,Shorts,Navy Blue,Summer,2012,Casual,Gini and Jony Girls Woven Navy Blue Shorts,
20031,Men,Apparel,Topwear,Shirts,Black,Fall,2011,Casual,United Colors of Benetton Men Striped Black Shirt,
37086,Women,Accessories,Bags,Mobile Pouch,Black,Summer,2012,Casual,Lino Perros Women Black Mobile Pouch,
4781,Women,Apparel,Topwear,Tshirts,Brown,Summer,2011,Sports,ADIDAS Women's Balance Brown T-shirt,
52411,Women,Apparel,Loungewear and Nightwear,Nightdress,Maroon,Winter,2015,Casual,Red Rose Maroon Nightdress,
39920,Unisex,Accessories,Bags,Laptop Bag,Brown,Fall,2012,Casual,Tortoise Unisex Brown Ipad Bag,
8970,Men,Footwear,Shoes,Sports Shoes,Red,Fall,2011,Sports,Puma Men 65cc Ducati Red Sports Shoes,
51294,Boys,Accessories,Eyewear,Sunglasses,Black,Fall,2012,Casual,Hop Scotch Boys Black Sunglasses,
16553,Men,Apparel,Topwear,Tshirts,White,Fall,2011,Casual,Basics Men White Printed Polo T-shirt,
22766,Women,Apparel,Topwear,Kurtas,Red,Fall,2011,Ethnic,BIBA Women Solid Red Kurta,
7104,Unisex,Accessories,Bags,Backpacks,Grey,Winter,2015,Casual,Wildcraft Unisex Grey Backpack,
34603,Men,Apparel,Innerwear,Briefs,Navy Blue,Summer,2016,Casual,Hanes Men Navy Blue Boxer Brief,
17481,Men,Footwear,Shoes,Formal Shoes,Black,Fall,2011,Formal,Enroute Men Formal Black Formal Shoe,
50346,Women,Apparel,Topwear,Kurtas,Pink,Summer,2012,Ethnic,Aurelia Women Pink Kurta,
31371,Men,Apparel,Topwear,Tshirts,Navy Blue,Summer,2012,Casual,Locomotive Men Printed Navy Blue T-shirt,
42683,Women,Apparel,Topwear,Kurtas,White,Summer,2012,Ethnic,Alma Women White Printed Kurta,
55634,Women,Footwear,Shoes,Heels,Gold,Summer,2016,Casual,Catwalk Women Gold Heels,
7938,Men,Apparel,Topwear,Tshirts,Black,Fall,2011,Sports,Puma Men's Glitch Music TV Black White T-shirt,
27214,Men,Apparel,Bottomwear,Shorts,Brown,Summer,2012,Casual,Doodle Kids Boy  Brown Shorts,
43751,Women,Accessories,Jewellery,Bangle,Gold,Summer,2012,Casual,Royal Diadem Set of 2 Golden Bangles,
46011,Women,Apparel,Saree,Sarees,Maroon,Summer,2012,Ethnic,Fabindia Maroon Sari,
16761,Women,Accessories,Bags,Handbags,Olive,Winter,2015,Casual,Spice Art Women Leatherette  Olive Handbags,
22554,Unisex,Personal Care,Fragrance,Deodorant,Silver,Spring,2017,Casual,Reebok Unisex Reekick Deo,
49865,Unisex,Accessories,Watches,Watches,Black,Winter,2016,Casual,Q&Q Kids Unisex Black Digital Watch,
23486,Men,Accessories,Scarves,Scarves,Grey,Summer,2012,Casual,Arrow Men Grey Check Scarf,
50174,Women,Footwear,Shoes,Flats,Purple,Winter,2012,Casual,Rocia Women Multi- Coloured Shoes,
3796,Men,Apparel,Topwear,Tshirts,White,Summer,2011,Casual,Basics Men White & Red Striped Polo T-shirt,
31143,Boys,Apparel,Topwear,Tshirts,Green,Summer,2012,Casual,Gini and Jony Boys Printed Green T-shirt,
49059,Men,Footwear,Shoes,Casual Shoes,Charcoal,Summer,2012,Casual,Flying Machine Men Charcoal Shoes,
43563,Women,Accessories,Socks,Socks,White,Summer,2012,Casual,Puma Women Pack of 3 Socks,
28852,Men,Apparel,Topwear,Tshirts,Brown,Summer,2013,Casual,Proline Brown Polo T-shirt,
2644,Women,Accessories,Bags,Handbags,Red,Winter,2015,Casual,Murcia Women Embroidered Canvas Bag,
50948,Women,Apparel,Bottomwear,Jeans,Black,Winter,2011,Casual,Lee Women Black Jeans,
30091,Women,Accessories,Watches,Watches,Black,Winter,2016,Casual,Ed Hardy Women Black Watch,
27026,Women,Apparel,Bottomwear,Shorts,Blue,Summer,2012,Casual,Jealous 21 Women Blue Cropped Denim Shorts,
13213,Women,Footwear,Shoes,Sports Shoes,White,Spring,2012,Sports,ASICS Women Gel Cumulus Running White Sports Shoes,
57351,Women,Apparel,Innerwear,Bra,Black,Winter,2015,Casual,Amante Black T-Shirt Bra BGSB02,
10496,Women,Apparel,Topwear,Tshirts,White,Fall,2011,Casual,Flying Machine Women RN White Tshirts,
41234,Boys,Apparel,Bottomwear,Shorts,Black,Summer,2012,Casual,Gini and Jony Boys Black Shorts,
25771,Men,Apparel,Topwear,Suspenders,Brown,Summer,2012,Formal,Lino Perros Men Light Brown Suspenders,
11544,Women,Apparel,Topwear,Kurtas,Green,Summer,2011,Ethnic,Women Printed Green Kurtas,
56283,Women,Apparel,Innerwear,Bra,Skin,Summer,2017,Casual,Biara Beige Everyday Support Bra,
5461,Men,Footwear,Shoes,Sports Shoes,Black,Summer,2011,Sports,Nike Men's Downshifter Lea Black Shoe,
44746,Men,Footwear,Shoes,Casual Shoes,Olive,Summer,2012,Casual,Globalite Men Olive Sparta Shoes,
14036,Men,Apparel,Topwear,Shirts,Pink,Fall,2011,Casual,Flying Machine Men Check Pink Shirts,
58319,Men,Accessories,Socks,Socks,White,Summer,2016,Sports,Jockey LWhite Pack of 3 Socks 2004,
20203,Men,Apparel,Topwear,Sweatshirts,Black,Fall,2011,Casual,Wrangler Men Flock Print Black Sweatshirt,
52623,Women,Accessories,Bags,Handbags,Black,Summer,2012,Casual,Mod'acc Women Black & Grey Handbag,
36366,Men,Accessories,Ties,Ties,Navy Blue,Summer,2012,Formal,Reid & Taylor Men Navy Blue Tie,
40120,Women,Apparel,Topwear,Tshirts,Green,Summer,2012,Casual,ADIDAS Women Green T-shirt,
10650,Men,Apparel,Topwear,Shirts,Blue,Fall,2011,Casual,Doodle Boy Grand Prix Navy Blue Shirt,
57197,Women,Apparel,Topwear,Tunics,Blue,Summer,2012,Casual,Elle Women BlueTunic,
56045,Women,Personal Care,Lips,Lipstick,Maroon,Spring,2017,Casual,Colorbar Plum Show Lipstick 06,
53537,Women,Apparel,Innerwear,Briefs,Multi,Winter,2015,Casual,Amante Women Pack of 3 Assorted Briefs PFCP12,
38806,Men,Apparel,Topwear,Tshirts,Red,Summer,2012,Casual,Marvel Men Red Printed T-shirt,
44580,Men,Apparel,Bottomwear,Jeans,Black,Summer,2017,Casual,Lee Men Black Jet Jeans,
4775,Women,Apparel,Bottomwear,Track Pants,Black,Summer,2011,Sports,ADIDAS Women 3S Black Track Pants,
56879,Women,Footwear,Shoes,Heels,Black,Winter,2012,Casual,HM Women Black Heels,
21117,Men,Apparel,Topwear,Shirts,White,Fall,2011,Casual,s.Oliver Men Solid White Shirt,
15322,Men,Apparel,Topwear,Jackets,Black,Fall,2011,Casual,Nike Men Solid Black Jacket,
51260,Men,Accessories,Belts,Belts,Black,Spring,2013,Formal,Par Men Black & Brown Reversible Belt,
8984,Men,Footwear,Shoes,Casual Shoes,Green,Fall,2011,Casual,Puma Men TX-3 Green Casual Shoes,
22792,Men,Apparel,Topwear,Tshirts,White,Fall,2011,Casual,Manchester United Men White Tshirt,
35725,Men,Footwear,Shoes,Sports Shoes,Beige,Summer,2012,Sports,Force 10 Men Beige Sports Shoes,
47305,Women,Accessories,Bags,Handbags,Brown,Summer,2012,Casual,Baggit Women Brown Handbag,
6022,Men,Apparel,Topwear,Tshirts,Black,Summer,2011,Casual,UCB Men's Johny Collar With Two Tone Black T-shirt,
9856,Men,Apparel,Topwear,Tshirts,Red,Fall,2011,Casual,Status Quo Men Red Polo Tshirts,
31385,Men,Apparel,Topwear,Tshirts,Grey,Summer,2012,Casual,Locomotive Men Printed Grey T-shirt,
3550,Men,Footwear,Shoes,Casual Shoes,Brown,Winter,2015,Casual,Skechers Men's Brown Lifestyle Shoe,
42677,Women,Apparel,Topwear,Kurtas,Green,Summer,2012,Ethnic,Alma Women Green Kurta,
12107,Women,Apparel,Topwear,Kurtis,Cream,Fall,2011,Ethnic,W Women Cream Kurtis,
26332,Women,Accessories,Watches,Watches,White,Winter,2016,Casual,DKNY Women White Dial Watch NY4716,
54712,Women,Apparel,Apparel Set,Kurta Sets,Black,Fall,2012,Ethnic,Shree Women Black & White Printed Salwar Suit with Dupatta,
30257,Men,Footwear,Shoes,Casual Shoes,Grey,Winter,2018,Casual,Red Tape Men Grey Shoes,
2482,Women,Apparel,Topwear,Tops,Black,Fall,2011,Casual,Puma Women Black Spagetti Top,
51052,Women,Apparel,Innerwear,Briefs,Black,Summer,2017,Casual,Enamor Women Black Bikini Briefs,
49891,Unisex,Accessories,Watches,Watches,Blue,Winter,2016,Casual,Q&Q Kids Unisex Blue Analog Watch,
23472,Men,Accessories,Scarves,Scarves,Purple,Winter,2015,Casual,Lino Perros Men Purple Scarf,
48943,Men,Accessories,Jewellery,Pendant,Steel,Summer,2012,Casual,Revv Men Steel Pendant,
50180,Women,Accessories,Bags,Handbags,Red,Summer,2012,Casual,Peperone Women Red Handbag,
17647,Men,Footwear,Flip Flops,Flip Flops,Red,Spring,2013,Casual,Converse Men Red Flip Flops,
30859,Women,Apparel,Topwear,Kurtas,Pink,Summer,2012,Ethnic,Fabindia Women Pink Kurta,
47137,Women,Accessories,Bags,Handbags,Cream,Summer,2015,Casual,Be For Bag Women Cream And Black Tote Bag,
3762,Men,Apparel,Topwear,Tshirts,Purple,Summer,2011,Casual,Status Quo Men's Surfers Purple T-shirt,
30065,Men,Accessories,Watches,Watches,Charcoal,Winter,2016,Casual,Ed Hardy Men Grey Dial Watch,
9258,Men,Apparel,Topwear,Shirts,Green,Fall,2011,Formal,Mark Taylor Men Green Striped Shirt,
54520,Men,Footwear,Shoes,Casual Shoes,White,Fall,2012,Casual,F Sports Men White Vito Shoes,
10462,Men,Apparel,Topwear,Tshirts,White,Fall,2011,Casual,Flying Machine Men White Polo Tshirts,
24657,Men,Accessories,Socks,Socks,Brown,Summer,2016,Casual,Levis Men Pack of 3 Casual Socks,
38208,Women,Accessories,Eyewear,Sunglasses,Grey,Winter,2016,Casual,Poid Women Sunglasses,
40312,Unisex,Footwear,Sandal,Sandals,White,Spring,2013,Casual,Warner Bros Kids White sandals,
25785,Men,Apparel,Topwear,Suspenders,Blue,Summer,2012,Formal,Arrow Men Blue Suspenders,
56277,Women,Apparel,Innerwear,Bra,Maroon,Summer,2017,Casual,Biara Maroon Everyday Support Bra MW 1002,
5495,Men,Apparel,Topwear,Tshirts,Green,Summer,2011,Casual,Mr.Men Men's Perfect Green Polo T-shirt,
37240,Men,Footwear,Shoes,Casual Shoes,Brown,Summer,2012,Casual,United Colors of Benetton Men Brown Shoes,
1809,Women,Apparel,Topwear,Tshirts,Blue,Fall,2010,Sports,Decathlon Profilter Women Blue T-shirt,
21325,Men,Accessories,Eyewear,Sunglasses,Black,Winter,2016,Casual,Louis Philippe Men Aviator Sunglasses LP201-C2,
15110,Men,Apparel,Bottomwear,Trousers,Black,Fall,2011,Formal,Arrow Men TR Finish Black Trousers,
45660,Men,Apparel,Innerwear,Innerwear Vests,Black,Summer,2016,Casual,Park Avenue Men Black Square Neck Vest,
4547,Men,Footwear,Shoes,Sports Shoes,White,Summer,2011,Sports,Nike Men's Egoli White Black Shoe,
36392,Men,Accessories,Socks,Socks,Grey,Summer,2016,Casual,Reid & Taylor Men Grey Socks,
17223,Women,Accessories,Eyewear,Sunglasses,Black,Winter,2016,Casual,United Colors of Benetton Women Funky Eyewear Black Sunglasses,
47553,Women,Footwear,Shoes,Heels,Black,Winter,2012,Casual,Portia Women Black Heels,
6674,Women,Footwear,Shoes,Sports Shoes,Black,Summer,2011,Sports,Nike Women Lunar Swift Black Shoe,
54978,Women,Apparel,Loungewear and Nightwear,Lounge Pants,Blue,Summer,2017,Casual,Femella Women Printed Blue Lounge Pants,
35173,Unisex,Accessories,Bags,Duffel Bag,Red,Summer,2015,Casual,Wildcraft Unisex Black & Red Duffel Bag,
46481,Women,Accessories,Watches,Watches,Lavender,Winter,2016,Casual,Timex Women Lavender Dial Watch,
51436,Women,Apparel,Topwear,Tops,White,Summer,2012,Casual,Myntra Women White & Pink Top,
13683,Men,Footwear,Shoes,Sports Shoes,Blue,Fall,2011,Sports,ADIDAS Men Adi Quest Blue Sports Shoes,
54144,Women,Footwear,Shoes,Heels,Brown,Winter,2012,Casual,Rocia Women Brown Sandals,
12751,Men,Apparel,Bottomwear,Jeans,Blue,Fall,2011,Casual,Spykar Men Ep Jeans Blue Jeans,
3306,Men,Footwear,Shoes,Sports Shoes,White,Spring,2011,Sports,Asics Men's Gel Phoenix 3 Running White Black Shoe,
42021,Women,Footwear,Shoes,Casual Shoes,Black,Summer,2012,Casual,ADIDAS Women Black Vigor Shoes,
32356,Men,Accessories,Watches,Watches,Beige,Winter,2016,Casual,Q&Q Men Beige Dial Watch,
56613,Women,Personal Care,Makeup,Highlighter and Blush,Rust,Spring,2017,NA,Streetwear True Color Plush Plum Blusher,
10006,Men,Apparel,Topwear,Tshirts,Black,Fall,2011,Sports,Nike Men AS T90 Black Tshirts,
24233,Women,Apparel,Topwear,Kurtas,Brown,Fall,2012,Ethnic,La-Emotio Women Caramel Brown Kurta,
33284,Men,Apparel,Topwear,Tshirts,White,Summer,2012,Casual,Arrow Sport Men Multi Coloured Striped Polo T-shirt,
40776,Men,Footwear,Flip Flops,Flip Flops,Black,Summer,2012,Casual,Quiksilver Men Black Flip Flops,
21741,Unisex,Footwear,Shoes,Casual Shoes,White,Fall,2011,Casual,Vans Unisex Authentic Lo Pro White Casual Shoes,
15574,Boys,Apparel,Topwear,Tshirts,Purple,Fall,2011,Casual,Chhota Bheem Kids Boys Best Friends Group TShirt,
45204,Women,Accessories,Watches,Watches,Purple,Winter,2016,Casual,CASIO ENTICER Women Purple Dial Watch A659 LTP-1294D-6ADF,
4123,Unisex,Footwear,Shoes,Casual Shoes,White,Summer,2011,Casual,Puma Unisex Lo Punk White Green Red Shoe,
37624,Boys,Apparel,Topwear,Tshirts,Navy Blue,Summer,2012,Casual,Madagascar3 Boys Navy Blue T-Shirt,
53361,Women,Accessories,Bags,Backpacks,Pink,Summer,2012,Casual,Puma Women Pink & Grey Backpack,
56421,Women,Apparel,Innerwear,Bra,Black,Summer,2017,Casual,Biara Women Black  Bra,
32164,Women,Accessories,Socks,Socks,Navy Blue,Summer,2017,Casual,Playboy Women Playmate Navy Blue Ankle Socks,
40544,Women,Accessories,Watches,Watches,Black,Winter,2016,Casual,Titan Raga Women Black Dial Watch,
45036,Men,Accessories,Watches,Watches,Black,Winter,2016,Casual,Maxima Attivo Men Black Dial Watch,
4311,Unisex,Apparel,Topwear,Tshirts,Green,Summer,2011,Casual,Tantra Kid's Unisex Muscle Man Green Kidswear,
21573,Men,Accessories,Socks,Socks,Multi,Winter,2015,Casual,Lino Perros Men Pack of Five Pair Socks,
59469,Women,Accessories,Jewellery,Ring,Gold,Summer,2013,Casual,Lucera Gold Plated Ring,
15746,Men,Footwear,Shoes,Sports Shoes,White,Spring,2013,Sports,Nike Men Ballista II White Sports Shoes,
32958,Men,Apparel,Topwear,Tshirts,Charcoal,Summer,2012,Casual,Angry Birds Men Printed Charcoal Grey T-shirt,
52081,Men,Apparel,Topwear,Tshirts,Grey,Summer,2012,Casual,Myntra Men Grey & Red T-shirt,
14694,Men,Apparel,Bottomwear,Trousers,Green,Fall,2011,Casual,Basics Men Green Trousers,
37416,Women,Accessories,Bags,Handbags,White,Summer,2012,Casual,Murcia Women White Handbag,
47761,Women,Accessories,Bags,Handbags,Black,Summer,2012,Casual,Murcia WomenBlack Handbag,
6446,Men,Footwear,Shoes,Casual Shoes,Grey,Summer,2011,Casual,Lotto Men's Calcetto Grey Shoe,
34293,Women,Apparel,Topwear,Dupatta,Orange,Summer,2012,Ethnic,Fabindia Women Orange Chanderi Dupatta,
18865,Men,Apparel,Topwear,Sweatshirts,Red,Fall,2011,Casual,Puma Men Red Sports Heritage Sweatshirt,
23224,Women,Apparel,Topwear,Kurtas,Cream,Fall,2011,Ethnic,Aneri Women Desire Cream Kurta,
17011,Women,Footwear,Shoes,Flats,Silver,Winter,2012,Casual,Rocia Women Brown Heels,
51604,Women,Apparel,Bottomwear,Jeans,Navy Blue,Fall,2012,Casual,Kraus Jeans Women Navy Blue Jeans,
3908,Women,Apparel,Bottomwear,Track Pants,Blue,Summer,2011,Casual,Urban Yoga Women's Fitted Yoga Blue Track Pant,
7594,Women,Footwear,Shoes,Sports Shoes,Cream,Summer,2011,Sports,Nike Women's Air Max Peach Cream Shoe,
35341,Women,Footwear,Shoes,Heels,Brown,Summer,2012,Casual,Senorita Women Brown Heels,
18059,Women,Accessories,Wallets,Wallets,Beige,Winter,2015,Casual,Lino Perros Women Solid Beige Wallet,
30633,Men,Apparel,Topwear,Tshirts,Grey,Summer,2012,Casual,Nike Men Dark Grey T-shirt,
3134,Women,Footwear,Shoes,Heels,Silver,Winter,2015,Casual,Catwalk Women Flat Studded Crystal Silver Flats,
42213,Women,Apparel,Topwear,Tops,Orange,Summer,2012,Casual,Sepia Women Orange Top,
39311,Men,Footwear,Flip Flops,Flip Flops,Multi,Summer,2012,Casual,Converse Men Multi Coloured Flip Flop,
44779,Men,Footwear,Shoes,Casual Shoes,White,Summer,2012,Casual,Lotto Men White Skateboard Shoes,
14009,Men,Apparel,Topwear,Tshirts,Black,Fall,2011,Casual,Nike Men Printed Black Tshirts,
58326,Women,Footwear,Flip Flops,Flip Flops,White,Summer,2012,Casual,Lotto Women White Flip Flops,
36359,Men,Accessories,Ties,Ties,Blue,Summer,2012,Formal,Reid & Taylor Men Blue Tie,
7309,Women,Apparel,Topwear,Tops,Pink,Summer,2011,Casual,UCB Women Quarter Sleeve Pink Top,
30892,Women,Apparel,Bottomwear,Patiala,White,Summer,2012,Ethnic,Fabindia Women Printed White & Orange Patiala,
28051,Men,Apparel,Innerwear,Briefs,Grey Melange,Summer,2016,Casual,Jockey ELANCE Men Grey Melange Pack of 2 Briefs 1009,
48988,Women,Accessories,Jewellery,Ring,Silver,Summer,2012,Casual,lll Women Silver Ring,
55439,Women,Personal Care,Lips,Lipstick,Pink,Spring,2017,Casual,Revlon Lilac Colorburst Lipstick 001,
19716,Men,Apparel,Topwear,Shirts,Blue,Fall,2011,Casual,United Colors of Benetton Men Solid Blue Shirt,
49066,Women,Accessories,Bags,Handbags,Navy Blue,Summer,2012,Casual,Lino Perros Women Navy Blue Handbag,
8341,Boys,Apparel,Topwear,Tshirts,Green,Fall,2011,Casual,Doodle Boy's Volleyball Champion Green White Kidswear,
50977,Women,Apparel,Innerwear,Bra,Beige,Summer,2017,Casual,Enamor Sand Coloured Lift Bra DB75,
27019,Women,Apparel,Bottomwear,Jeans,Blue,Summer,2012,Casual,Jealous 21 Women Washed Light Blue Jeans,
22759,Women,Apparel,Topwear,Kurtas,White,Fall,2011,Ethnic,BIBA Women Printed White Kurta,
50379,Women,Apparel,Bottomwear,Salwar and Dupatta,White,Summer,2012,Ethnic,Vishudh Women Black & White Salwar and Dupatta,
28263,Men,Personal Care,Fragrance,Deodorant,Blue,Spring,2017,Casual,Gatsby Men Aqua Deo,
19524,Men,Apparel,Topwear,Sweaters,Blue,Fall,2011,Casual,United Colors of Benetton Men Solid Blue Sweater,
7907,Men,Apparel,Topwear,Tshirts,Grey,Fall,2011,Casual,Proline Men Grey Polo T-shirt,
48386,Men,Apparel,Bottomwear,Jeans,Black,Summer,2012,Casual,French Connections Men Black Jeans,
33419,Women,Accessories,Bags,Handbags,Teal,Summer,2012,Casual,Baggit Women Sprinkle Dum Teal Sling Bag,
58928,Women,Accessories,Bags,Handbags,Olive,Summer,2010,Casual,Ivory Tag Olive Dip Sling Bag,
37885,Unisex,Accessories,Socks,Socks,Red,Summer,2016,Casual,Happy Socks Unisex Pack of 2 Socks,
36957,Men,Footwear,Shoes,Sports Shoes,White,Summer,2012,Sports,Force 10 Men White Sports Shoes,
39123,Women,Apparel,Bottomwear,Leggings,White,Fall,2012,Casual,Aneri Women White Leggings,
57960,Women,Apparel,Saree,Sarees,Beige,Summer,2012,Ethnic,Prafful Beige Printed Sari,
45499,Women,Apparel,Bottomwear,Capris,Navy Blue,Summer,2012,Casual,Fila Women Navy Blue Savari 3/4th Pants,
34258,Men,Apparel,Bottomwear,Tracksuits,Navy Blue,Summer,2013,Sports,Proline Men Navy Tracksuit,
28607,Men,Footwear,Shoes,Sports Shoes,White,Summer,2012,Sports,Nike Men Dart VII White Sports Shoes,
16108,Men,Accessories,Eyewear,Sunglasses,Brown,Winter,2016,Casual,M tv Men My Fab Eyewear Brown Sunglasses,
18092,Men,Apparel,Innerwear,Briefs,Navy Blue,Summer,2016,Casual,Crusoe Men Tanga Navy Blue Brief,
49630,Women,Apparel,Dress,Dresses,Blue,Summer,2012,Casual,Mineral Blue Dress,
8517,Unisex,Accessories,Bags,Backpacks,Navy Blue,Summer,2011,Sports,Nike Unisex Ultimatum Max Navy Blue Backpacks,
19140,Men,Footwear,Sandal,Sandals,Black,Fall,2011,Casual,Lotto Men Sting Black Sandals,
25118,Women,Accessories,Bags,Clutches,Black,Winter,2015,Casual,Lino Perros Women Beaded Black Clutch,
39547,Men,Footwear,Flip Flops,Flip Flops,Red,Summer,2012,Casual,Numero Uno Men Red Flip Flops,
52876,Women,Apparel,Saree,Sarees,Multi,Fall,2012,Ethnic,FNF Multi Coloured Printed Sari,
44913,Men,Apparel,Bottomwear,Track Pants,White,Summer,2012,Casual,Puma Men White Track Pants,
25924,Women,Apparel,Topwear,Tshirts,Orange,Summer,2012,Casual,Femella Women Orange T-shirt,
58570,Men,Apparel,Topwear,Tshirts,Green,Summer,2012,Casual,Puma Men Green T-shirt,
33841,Men,Footwear,Shoes,Casual Shoes,White,Summer,2012,Casual,Puma Men Drift Cat White Shoes,
5208,Men,Apparel,Topwear,Tshirts,White,Summer,2011,Casual,Superman Men's Crew White T-shirt,
39775,Men,Apparel,Topwear,Shirts,White,Summer,2012,Casual,Peter England Men White Casual Shirt,
5806,Women,Apparel,Topwear,Tshirts,Red,Summer,2011,Casual,ADIDAS Women's Graphic Red T-shirt,
59690,Women,Apparel,Innerwear,Bra,Grey,Summer,2014,Casual,Avirate Grey Bra,
11923,Men,Footwear,Shoes,Formal Shoes,Brown,Summer,2011,Formal,Franco Leone Men Formal Brown Formal Shoes,
58742,Men,Apparel,Topwear,Tshirts,Mushroom Brown,Summer,2012,Casual,Puma Men Mushroom Brown T-shirt,
28435,Women,Accessories,Watches,Watches,White,Winter,2016,Casual,DKNY Women White Dial Chronograph Watch NY8102,
43904,Men,Apparel,Topwear,Shirts,Blue,Summer,2012,Casual,Arrow Sport Men Blue Check Shirt,
47598,Women,Footwear,Shoes,Heels,Black,Winter,2012,Casual,Portia Women Black Wedges,
55861,Women,Personal Care,Nails,Nail Polish,Green,Spring,2017,Casual,Colorbar Moss Agate Nail Lacquer 93,
13648,Men,Footwear,Shoes,Sports Shoes,Silver,Fall,2011,Sports,ADIDAS Silver Astar ride 3M Sports Shoe,
34856,Men,Footwear,Shoes,Casual Shoes,Black,Summer,2012,Casual,Vans Men Classic Slip-On Black Shoes,
35984,Women,Apparel,Topwear,Tops,Blue,Summer,2012,Casual,Flying Machine Women Printed Cobalt Blue Top,
19372,Men,Footwear,Shoes,Formal Shoes,Brown,Winter,2018,Formal,Redtape Men Brown Formal Shoes,
22933,Women,Accessories,Watches,Watches,White,Winter,2016,Casual,Fastrack Women White Casual Watch,
8725,Men,Apparel,Topwear,Shirts,Black,Fall,2011,Casual,Indigo Nation Men Checks Shirt Black Shirts,
6479,Men,Apparel,Topwear,Tshirts,Black,Summer,2011,Casual,ADIDAS Men's Fresh Blue T-shirt,
29721,Men,Apparel,Topwear,Shirts,Purple,Summer,2012,Formal,John Miller Men Check Purple Shirt,
3937,Women,Apparel,Topwear,Tshirts,Pink,Summer,2011,Casual,Jealous 21 Women's Pink Miss T-shirt,
19988,Women,Apparel,Topwear,Tops,Grey,Fall,2011,Casual,United Color of Benetton Women Solid Grey Top,
17812,Men,Apparel,Topwear,Tshirts,Multi,Fall,2011,Casual,Chhota Bheem Kids Boy Krishna Balram Multi Tshirt,
9431,Men,Footwear,Shoes,Sports Shoes,Grey,Summer,2011,Sports,Decathlon Men Quechua Grey Sports Shoes,
48716,Women,Accessories,Jewellery,Earrings,Gold,Summer,2013,Casual,Lucera Gold Plated Earrings,
45835,Women,Apparel,Topwear,Kurtas,Blue,Summer,2012,Ethnic,Vishudh Women Blue Kurta,
52882,Women,Apparel,Saree,Sarees,White,Summer,2012,Ethnic,FNF Printed Peach Sari,
38461,Women,Accessories,Wallets,Wallets,Brown,Summer,2012,Casual,Baggit Women Brown Wallet,
45009,Men,Accessories,Watches,Watches,Steel,Winter,2016,Casual,Maxima Men Steel Dial Digital Multifunction Watch,
59456,Women,Accessories,Jewellery,Ring,Silver,Summer,2013,Casual,Luccera Silver Ring,
15779,Men,Apparel,Innerwear,Briefs,Blue,Summer,2016,Casual,Facit Men Blue String Bikini Briefs,
32967,Men,Apparel,Topwear,Tshirts,Grey,Summer,2012,Casual,Angry Birds Men Printed Grey T-shirt,
37429,Women,Accessories,Bags,Handbags,Lavender,Summer,2012,Casual,Murcia Women Lavender Handbag,
39781,Men,Apparel,Topwear,Shirts,White,Summer,2012,Formal,Peter England Men Striped White Formal Shirt,
32369,Men,Accessories,Watches,Watches,Black,Winter,2016,Casual,Q Men Black Dial Watch,
4920,Women,Apparel,Topwear,Tops,Pink,Summer,2011,Casual,Gini and Jony Girl's Veeya Pink Infant Kidswear,
10039,Men,Footwear,Shoes,Sports Shoes,White,Fall,2011,Sports,Reebok Men Raceon White Sports Shoes,
40749,Women,Footwear,Flip Flops,Flip Flops,Blue,Winter,2012,Casual,Roxy Women Blue Flip Flops,
38653,Men,Footwear,Shoes,Casual Shoes,Black,Summer,2012,Casual,Nike Men Avid Black Casual Shoes,
59664,Women,Apparel,Saree,Sarees,Purple,Fall,2012,Ethnic,FNF Purple & Blue Printed Sari,
10805,Men,Apparel,Topwear,Shirts,Black,Fall,2011,Casual,Wrangler Men Rider Solid Black Shirts,
14499,Men,Footwear,Shoes,Casual Shoes,Green,Fall,2011,Casual,Flying Machine Men Casual Green Casual Shoes,
23029,Men,Apparel,Topwear,Shirts,Blue,Fall,2011,Formal,Arqrow Men Blue Striped Shirt,
54947,Men,Apparel,Topwear,Tshirts,Off White,Summer,2012,Casual,Do u speak green Men Cream T-shirt,
7799,Men,Footwear,Shoes,Casual Shoes,White,Fall,2011,Casual,Puma Men's Manilla Hi White Shoe,
55895,Women,Personal Care,Nails,Nail Polish,Pink,Spring,2017,Casual,Colorbar Rasmopolitan Nail Lacquer 03,
29513,Women,Accessories,Watches,Watches,White,Winter,2016,Casual,Playboy Women White Dial Watch,
42822,Women,Apparel,Innerwear,Briefs,Black,Summer,2012,Casual,Little Miss Intimates Women Black Brief,
51409,Men,Apparel,Topwear,Shirts,Turquoise Blue,Summer,2012,Casual,Myntra Men Turquoise Blue Striped Shirt,
9603,Men,Apparel,Topwear,Shirts,Brown,Fall,2011,Casual,Scullers Men Scul Brown Black Shirts,
48524,Women,Apparel,Dress,Dresses,White,Summer,2012,Casual,French Connection Women White Dress,
23815,Men,Footwear,Shoes,Casual Shoes,Black,Fall,2011,Casual,Puma Men Evo Black Casual Shoes,
18254,Women,Apparel,Topwear,Kurtas,Green,Fall,2011,Ethnic,Aneri Women Protima Green Kurta,
27489,Women,Apparel,Innerwear,Briefs,White,Fall,2015,Casual,Jockey Women White Bikini Briefs,
19386,Men,Accessories,Mufflers,Mufflers,Red,Fall,2011,Casual,Reid & Taylor Men Check Red Muffler,
35970,Men,Apparel,Topwear,Tshirts,Black,Summer,2012,Casual,Flying Machine Men Tee Black T-shirt,
3339,Men,Apparel,Topwear,Tshirts,White,Summer,2011,Casual,Myntra Hero Within White T-shirt,
24668,Unisex,Footwear,Shoes,Casual Shoes,Navy Blue,Summer,2010,Casual,Converse Unisex Neon Print Navy Blue Casual Shoes,
38237,Unisex,Accessories,Eyewear,Sunglasses,Brown,Winter,2016,Casual,Polaroid Unisex Sunglasses,
15913,Men,Apparel,Topwear,Shirts,White,Fall,2011,Formal,Black Coffee Men Stripes White Shirt,
56248,Men,Apparel,Loungewear and Nightwear,Night suits,Black,Summer,2016,Casual,SDL by Sweet Dreams Men Black Lounge Set,
1836,Men,Footwear,Shoes,Sports Shoes,Silver,Fall,2010,Sports,Nike Air Visi Sleek Shoes,
4578,Men,Footwear,Shoes,Sports Shoes,Red,Summer,2011,Sports,Nike Men's Mercurial Gli Red Pink Shoe,
26903,Women,Apparel,Topwear,Tops,Pink,Summer,2012,Casual,Jealous 21 Women Pink Top,
29177,Boys,Apparel,Bottomwear,Shorts,Blue,Summer,2012,Casual,United Colors of Benetton Boys Blue Shorts,
17678,Women,Footwear,Shoes,Heels,Blue,Winter,2015,Casual,Catwalk Women Buckel Blue Flats,
30866,Women,Apparel,Topwear,Kurtas,Red,Summer,2012,Ethnic,Fabindia Women Red Kurta,
47108,Boys,Footwear,Sandal,Sandals,Black,Fall,2012,Casual,Marvel Boys Black Sandals,
49092,Women,Personal Care,Lips,Lip Liner,Coffee Brown,Spring,2017,Casual,Deborah 24 Ore Lip Liner 219,
31188,Men,Accessories,Wallets,Wallets,Black,Summer,2012,Casual,Cabarelli Men Black Wallet,
50983,Women,Apparel,Loungewear and Nightwear,Nightdress,Pink,Summer,2017,Casual,Enamor Women Pink Nightdress,
9267,Men,Apparel,Topwear,Shirts,Blue,Fall,2011,Casual,Scullers Men SculBlue Shirts,
