id,gender,masterCategory,subCategory,articleType,baseColour,season,year,usage,productDisplayName,
27075,Women,Footwear,Shoes,Heels,Black,Winter,2015,Casual,Catwalk Woamen Black Heels,
46042,Women,Accessories,Jewellery,Jewellery Set,Gold,Winter,2016,Casual,Estelle Women Gold Jewellery Set,
7365,Men,Footwear,Shoes,Casual Shoes,Black,Winter,2018,Casual,Red Tape Men's Black Casual Shoe,
49836,Women,Footwear,Flip Flops,Flip Flops,Gold,Winter,2012,Casual,iPanema Women Gold Flip Flops,
16732,Men,Footwear,Flip Flops,Flip Flops,Brown,Fall,2011,Casual,Lotto Men Earth Brown Slipper,
34462,Unisex,Accessories,Bags,Laptop Bag,Black,Summer,2012,Casual,ADIDAS Unisex Black Laptop Sleeve,
47190,Men,Footwear,Shoes,Formal Shoes,Brown,Summer,2012,Formal,Franco Leone Men Brown Shoes,
27849,Women,Apparel,Topwear,Tshirts,Red,Summer,2012,Casual,Scullers For Her Red Polo T-shirt,
52214,Women,Accessories,Jewellery,Pendant,Silver,Fall,2012,Casual,Lencia Sterling Silver Pendant,
4184,Men,Footwear,Shoes,Casual Shoes,Brown,Summer,2011,Casual,Rockport Men D2N Desert Boot Dark Brown Shoe,
36751,Girls,Apparel,Topwear,Tops,White,Summer,2012,Casual,Little Miss Girls Blah White Top,
44371,Men,Apparel,Topwear,Tshirts,Purple,Summer,2012,Casual,Classic Polo Men Purple T-shirt,
37683,Unisex,Accessories,Bags,Backpacks,Black,Summer,2012,Casual,American Tourister Unisex Backpack,
14401,Women,Footwear,Shoes,Heels,Blue,Summer,2012,Casual,Enroute Women Steelblue Heels,
39719,Women,Apparel,Topwear,Tops,Beige,Summer,2012,Casual,Arrow Woman Beige Top,
41603,Men,Apparel,Topwear,Shirts,Black,Summer,2012,Casual,Basics Men Black Shirt,
11173,Men,Apparel,Topwear,Sweaters,Red,Fall,2011,Casual,Scullers Men Stripes Red Sweaters,
25346,Men,Apparel,Innerwear,Briefs,Black,Summer,2016,Casual,Levis Men Black  Brief,
24294,Men,Accessories,Socks,Socks,Navy Blue,Summer,2016,Casual,Quiksilver Men High Navy Blue Socks,
57766,Women,Personal Care,Skin Care,Face Scrub and Exfoliator,Cream,Spring,2017,Casual,Lotus Herbals Apriscrub Fresh Apricot Scrub 60g,
2273,Men,Apparel,Topwear,Tshirts,Red,Summer,2011,Sports,Nike Mens Red Polo T-shirt,
43154,Women,Accessories,Watches,Watches,Purple,Winter,2016,Casual,Fastrack Women Purple Dial Watch,
13624,Men,Apparel,Loungewear and Nightwear,Lounge Shorts,Red,Summer,2016,Casual,Hanes Men Knitted Red Shorts,
27411,Women,Apparel,Loungewear and Nightwear,Lounge Pants,Maroon,Winter,2015,Casual,Jockey Women Maroon Lounge Pants,
55031,Women,Personal Care,Lips,Lipstick,Purple,Spring,2017,Casual,Lakme Absolute Matte Pure Glam Lipstick 201,
42086,Men,Footwear,Shoes,Sports Shoes,White,Summer,2012,Sports,ADIDAS Men Mars White Sports Shoes,
31574,Men,Apparel,Topwear,Tshirts,Beige,Summer,2012,Casual,Mark Taylor Men Printed Beige T-shirt,
8749,Men,Apparel,Topwear,Shirts,Purple,Fall,2011,Casual,Indigo Nation Men Stripes Shirt Purple Shirts,
50543,Men,Apparel,Innerwear,Briefs,White,Summer,2016,Casual,Chromozome Men White Briefs,
17284,Men,Apparel,Topwear,Tshirts,Blue,Fall,2011,Casual,U.S. Polo Assn. Men Stripes Fedral Blue Polo  Tshirt,
28459,Women,Apparel,Bottomwear,Shorts,Purple,Summer,2012,Sports,Urban Yoga Women Purple Shorts,
43968,Men,Personal Care,Fragrance,Perfume and Body Mist,Red,Spring,2017,Casual,DKNY Men Red Delicious Men Spray Perfume,
34006,Girls,Apparel,Topwear,Tops,Purple,Summer,2012,Casual,Gini and Jony Girls Purple Top,
46426,Men,Accessories,Watches,Watches,White,Winter,2016,Casual,Timex Men White Dial Watch,
7701,Women,Apparel,Topwear,Tshirts,Pink,Fall,2011,Casual,Jealous 21 Women's She's Attitude Scarlet Pink T-shirt,
22163,Men,Footwear,Shoes,Casual Shoes,Navy Blue,Fall,2012,Casual,Timberland Men Navy Blue Casual Shoes,
13416,Men,Apparel,Topwear,Shirts,Pink,Summer,2011,Casual,United Colors of Benetton Men Check Pink Shirts,
27623,Men,Apparel,Bottomwear,Shorts,Beige,Summer,2012,Casual,Scullers Men Beige Shorts,
30694,Women,Footwear,Shoes,Heels,Black,Winter,2015,Casual,Catwalk Wwomen Black Heels,
2041,Men,Apparel,Topwear,Tshirts,Grey,Fall,2010,Sports,ADIDAS Mens Fire Grey T-shirt,
43366,Women,Footwear,Shoes,Flats,Navy Blue,Summer,2012,Casual,Reebok Women Navy Blue Casual Shoes,
16958,Men,Accessories,Eyewear,Sunglasses,Blue,Winter,2016,Casual,Men Sunglasses,
3193,Men,Apparel,Topwear,Tshirts,Beige,Summer,2011,Casual,Tantra Men's Nerds Light Brown T-shirt,
55203,Women,Personal Care,Lips,Lip Care,Pink,Spring,2017,Casual,Lakme Lip Love Flirt Lip Conditioner,
34234,Men,Apparel,Topwear,Tshirts,Navy Blue,Summer,2013,Casual,Proline Men Navy Polo T-shirt,
23283,Men,Accessories,Watches,Watches,White,Winter,2016,Casual,Maxima Ssteele Men White Watch,
22351,Men,Apparel,Topwear,Shirts,Green,Fall,2011,Casual,John Players Men Check Green Shirt,
16164,Men,Footwear,Sandal,Sandals,Brown,Summer,2012,Casual,Enroute Men Leather Brown Sandals,
46614,Women,Footwear,Shoes,Heels,Black,Winter,2012,Casual,Catwalk Women aBlack Heels,
7533,Men,Apparel,Bottomwear,Shorts,Black,Summer,2011,Sports,Nike Men's As T90 Black Short,
19910,Unisex,Accessories,Bags,Duffel Bag,Blue,Winter,2015,Casual,Wildcraft Unisex Blue and Grey Printed Duffel Bag,
36563,Men,Apparel,Topwear,Tshirts,Blue,Summer,2012,Casual,Jack & Jones Men Polo Blue T-shirt,
25948,Women,Accessories,Scarves,Scarves,Green,Summer,2012,Casual,Femella Women Green Scarf,
45091,Women,Apparel,Innerwear,Bra,Lavender,Winter,2015,Casual,Bwitch Enchant Lavender & White Printed Bra RTV-BW297,
52026,Unisex,Apparel,Topwear,Rain Jacket,Grey,Summer,2012,NA,Just Natural Unisex Grey Rain Jacket,
20406,Women,Accessories,Wallets,Wallets,Green,Winter,2015,Casual,Baggit Women Zanzil Taj Green Wallet,
14633,Women,Apparel,Topwear,Tops,Green,Fall,2011,Casual,United Colors of Benetton Women Printed Green Tops,
44143,Men,Personal Care,Fragrance,Perfume and Body Mist,Black,Spring,2017,Casual,Boss Men Number One Perfume,
5264,Unisex,Accessories,Bags,Messenger Bag,Black,Winter,2015,Casual,Wildcraft Unisex Black Corporate Messenger Bag,
56486,Women,Personal Care,Nails,Nail Polish,Red,Spring,2017,NA,Streetwear Berry Shine Nail Polish # 79,
11341,Men,Apparel,Bottomwear,Jeans,Blue,Summer,2017,Casual,Lee Men Light Blue Chicago Fit Jeans,
25174,Women,Accessories,Bags,Handbags,Brown,Winter,2015,Casual,Lino Perros Women Lea Brown Handbag,
10293,Men,Footwear,Sandal,Sandals,Brown,Spring,2012,Casual,Clarks Men Unstructured Leather Brown Sandals,
57554,Women,Personal Care,Lips,Lipstick,Brown,Spring,2017,NA,Lotus Herbals SPF-10 Coffee Berry Lipstick 422,
8586,Men,Apparel,Topwear,Shirts,Red,Fall,2011,Casual,Scullers Men Red Shirt,
42249,Women,Apparel,Topwear,Tunics,Blue,Summer,2012,Casual,Sepia Women Blue Tunic,
12539,Women,Apparel,Topwear,Tshirts,Black,Fall,2011,Casual,Tantra Women Black Printed T-shirt,
18003,Men,Apparel,Topwear,Tshirts,Blue,Summer,2011,Sports,Puma Men Training Polo Blue Tshirt,
9454,Men,Apparel,Topwear,Shirts,White,Fall,2011,Formal,John Miller Men White Check Shirt,
17877,Men,Apparel,Innerwear,Innerwear Vests,Beige,Summer,2016,Casual,Levisi Men Comfort Style Beige Innerwear Vest,
30669,Men,Accessories,Eyewear,Sunglasses,Steel,Winter,2016,Casual,Park Avenue Men Steel Sunglasses,
3952,Women,Apparel,Topwear,Tops,Purple,Summer,2011,Casual,Jealous 21 Women Purple Top With Purple Flower Top,
16199,Men,Apparel,Topwear,Tshirts,Blue,Fall,2011,Casual,Puma Men Blue Polo T-Shirt,
29744,Men,Accessories,Watches,Watches,Black,Winter,2016,Casual,Fossil Men Black Dial Chronograph Watch CH2783,
28696,Women,Apparel,Topwear,Kurtas,Rust,Summer,2012,Ethnic,W Women Printed Rust Kurta,
2880,Women,Footwear,Shoes,Heels,Grey,Summer,2016,Formal,Catwalk Women Leather Formal Grey Heels,
53109,Women,Accessories,Jewellery,Earrings,Silver,Winter,2016,Casual,Fabindia Silvering Earrings,
5299,Unisex,Accessories,Bags,Backpacks,Red,Summer,2011,Casual,Reebok Unisex Red Backpack,
24867,Men,Accessories,Belts,Belts,Black,Summer,2012,Casual,Reid & Taylor Men Casual Black Belt,
59433,Women,Accessories,Bags,Clutches,Red,Summer,2015,Casual,Spice Art Women Red Clutch,
53935,Women,Accessories,Bags,Handbags,Brown,Summer,2012,Casual,Kiara Women Brown Handbag,
38404,Women,Accessories,Belts,Belts,Purple,Summer,2012,Casual,Baggit Women Purple Xylo Taj Belt,
44982,Women,Accessories,Watches,Watches,White,Winter,2016,Casual,Maxima Women White Dial Watch,
25189,Women,Accessories,Bags,Handbags,Beige,Winter,2015,Casual,Lino Perros Women Classic Beige Handbag,
45850,Women,Apparel,Topwear,Kurtas,Blue,Summer,2012,Ethnic,Vishudh Women Blue Kurta,
59601,Women,Apparel,Saree,Sarees,Brown,Summer,2012,Ethnic,FNF Brown Wedding Collection Sari,
4179,Men,Footwear,Shoes,Formal Shoes,Black,Summer,2011,Formal,Rockport Men's Tyson Black Shoe,
5897,Women,Footwear,Shoes,Casual Shoes,White,Summer,2011,Casual,Puma Women's Feuerwerk White Shoe,
24269,Men,Apparel,Topwear,Tshirts,Grey,Fall,2011,Casual,Quiksilver Men Grey Printed T-shirt,
38636,Men,Apparel,Topwear,Tshirts,Blue,Summer,2012,Casual,Nike Men Blue Cricket Tee T-shirt,
56649,Women,Apparel,Topwear,Kurtis,Cream,Fall,2012,Ethnic,Mumbai Slang Women Cream Kurti,
4945,Men,Apparel,Topwear,Tshirts,White,Summer,2011,Casual,Gini and Jony Boy's Kaniel White Yellow Kidswear,
35915,Women,Accessories,Bags,Handbags,Blue,Spring,2013,Casual,Peperone Women Blue Handbag,
31589,Men,Apparel,Topwear,Tshirts,Black,Summer,2012,Casual,Mark Taylor Men Printed Black T-shirt,
49493,Men,Footwear,Shoes,Casual Shoes,Green,Summer,2012,Casual,Vans Men Green & Grey Era Shoes,
23870,Men,Apparel,Bottomwear,Track Pants,Black,Fall,2011,Casual,ADIDAS Men Black  Track Pant,
48541,Men,Accessories,Belts,Belts,Brown,Summer,2012,Casual,Wrangler Men Brown Belt,
9666,Men,Apparel,Topwear,Shirts,Blue,Fall,2011,Casual,Indigo Nation Men Bling Blue Shirts,
18231,Men,Apparel,Topwear,Tshirts,Navy Blue,Fall,2011,Casual,Manchester United Men Printed Navy Blue Tshirt,
35129,Women,Accessories,Jewellery,Bangle,Red,Winter,2012,Casual,Allen Solly Woman Red Bangle,
42847,Women,Accessories,Bags,Clutches,Black,Summer,2012,Casual,French Connection Women Black Purse,
29576,Men,Footwear,Shoes,Casual Shoes,White,Summer,2012,Casual,Vans Men Fontana White Shoes,
17279,Men,Apparel,Topwear,Tshirts,Navy Blue,Fall,2011,Casual,U.S. Polo Assn. Men Printed Navy Blue Tshirt,
47509,Men,Apparel,Innerwear,Briefs,Brown,Summer,2016,Casual,Facit Men Brown Brief,
59265,Women,Accessories,Watches,Watches,White,Winter,2016,Casual,Titan Women Mother Of Pearl Watch,
1853,Men,Apparel,Topwear,Tshirts,Yellow,Summer,2011,Casual,Inkfruit Mens Little Bit More T-shirt,
14098,Men,Apparel,Topwear,Tshirts,Blue,Fall,2011,Casual,Flying Machine Men Printed Blue Tshirts,
15976,Men,Apparel,Topwear,Shirts,Purple,Fall,2011,Casual,Turtle Solid Men Purple Shirt,
32768,Men,Apparel,Topwear,Tshirts,Grey,Spring,2013,Casual,Music Men Printed Grey T-shirt,
39380,Men,Apparel,Bottomwear,Jeans,White,Summer,2012,Casual,Peter England Men Blue Party Jeans,
10438,Men,Apparel,Bottomwear,Jeans,Blue,Fall,2011,Casual,Flying Machine Men Midrise Blue Jeans,
48125,Women,Accessories,Belts,Belts,Multi,Summer,2012,Casual,Fossil Women Multi Coloured Ombre Braid Belt,
9202,Men,Footwear,Shoes,Casual Shoes,Red,Fall,2011,Casual,Puma Men Yacht L Red Casual Shoes,
27088,Women,Apparel,Topwear,Kurtas,Black,Summer,2012,Ethnic,Aneri Women Aaliya Black Kurta,
18655,Men,Footwear,Flip Flops,Flip Flops,Black,Fall,2011,Casual,Fila Men Drop Needle Black Slippers,
19787,Men,Apparel,Topwear,Tshirts,White,Winter,2016,Casual,U.S. Polo Assn. Men Solid White Tshirt,
46883,Boys,Footwear,Shoes,Casual Shoes,Black,Fall,2012,Casual,Ben 10 Boys Black & Silver Shoes,
3738,Men,Apparel,Topwear,Tshirts,White,Fall,2010,Sports,Lotto Men's Kochi Tuskers Cotton Graphic White T-shirt,
30803,Men,Apparel,Topwear,Shirts,Blue,Summer,2012,Ethnic,Fabindia Men Blue Shirt,
7398,Men,Footwear,Shoes,Formal Shoes,Brown,Winter,2018,Formal,Red Men Brown Shoes,
26966,Women,Apparel,Topwear,Shirts,Purple,Summer,2012,Casual,Jealous 21 Women Check Purple Shirt,
51008,Women,Apparel,Innerwear,Bra,Purple,Summer,2014,Casual,Enamor Purple Bra,
29112,Women,Accessories,Socks,Socks,White,Winter,2015,Casual,Puma Women Pack of 3 Socks,
18467,Men,Personal Care,Fragrance,Perfume and Body Mist,White,Spring,2017,Casual,Reebok Reegame Men Perfumes,
6844,Unisex,Accessories,Shoe Accessories,Shoe Accessories,Brown,Summer,2011,NA,Timberland Unisex Boot Lace Shoe Accessories,
9030,Men,Footwear,Shoes,Casual Shoes,Brown,Winter,2011,Casual,Buckaroo Men loma Brown Casual Shoes,
7996,Men,Apparel,Topwear,Tshirts,Purple,Fall,2011,Sports,Fila Men's Striper Pique Polo Purple Navy T-shirt,
26368,Women,Apparel,Topwear,Shirts,Red,Summer,2012,Casual,Arrow Woman Red Shirt,
29320,Men,Apparel,Topwear,Tshirts,Green,Summer,2012,Sports,ADIDAS Men Green Jersey,
12961,Men,Footwear,Sandal,Sandals,Brown,Fall,2011,Casual,ADIDAS Men Casual Brown Sandals,
45408,Women,Footwear,Shoes,Flats,Beige,Winter,2012,Casual,Rocia Women Beige & Brown Sandals,
15378,Men,Footwear,Shoes,Sports Shoes,Grey,Fall,2011,Sports,Fila Men Coloda Grey Sports Shoes,
58185,Women,Accessories,Bags,Handbags,Purple,Summer,2012,Casual,Rocky S Women Purple Handbag,
40946,Girls,Apparel,Topwear,Tops,Navy Blue,Summer,2012,Casual,Gini and Jony Girls Nautical Blues Navy Blue Top,
21971,Women,Accessories,Bags,Handbags,Green,Winter,2015,Casual,Murcia Women Casual Multi Handbag,
33488,Men,Apparel,Topwear,Shirts,Purple,Summer,2012,Casual,Doodle Kids Boy Check Purple Shirt,
52679,Women,Accessories,Watches,Watches,Bronze,Winter,2016,Casual,Morellato Women Silver Dial Watch,
59291,Men,Accessories,Watches,Watches,Grey,Winter,2016,Casual,Titan Edge Men Grey Dial Watch,
20259,Men,Apparel,Topwear,Tshirts,White,Fall,2011,Casual,Wrangler Men Polo White T-shirt,
39374,Women,Accessories,Watches,Watches,Green,Winter,2016,Casual,Helix Women Green Dial Watch,
15982,Men,Apparel,Topwear,Shirts,Grey,Fall,2011,Casual,Turtle Stripes Men Grey Shirt,
14850,Men,Accessories,Wallets,Wallets,Black,Summer,2011,Casual," Colors of Benetton Men Solid Black Wallets",
28808,Men,Apparel,Topwear,Shirts,Black,Summer,2012,Casual,Denizen Men Striped Black Shirt,
43539,Women,Apparel,Topwear,Tops,White,Summer,2012,Casual,French Connection Women Multicoloured Striped Top,
13249,Men,Apparel,Bottomwear,Trousers,Brown,Fall,2011,Casual,Palm Tree Kids Boy Solid Brown Trousers,
19773,Women,Apparel,Bottomwear,Stockings,Grey,Fall,2011,Casual,United Colors of Benetton Women Grey Striped Tights,
46877,Men,Accessories,Socks,Socks,Beige,Summer,2012,Casual,Lino Perros Men Pack of 2 Socks,
31119,Girls,Apparel,Topwear,Tops,Purple,Summer,2012,Casual,Gini and Jony Girls Purple Top,
8324,Boys,Apparel,Topwear,Tshirts,White,Fall,2011,Casual,Doodle Boy's Athletic 77 Dept White Kidswear,
28034,Men,Apparel,Innerwear,Briefs,Charcoal,Summer,2016,Casual,Jockey ELANCE Men Charcoal Grey Y Front Briefs 1006,
47199,Men,Footwear,Shoes,Formal Shoes,Brown,Summer,2012,Formal,Franco Leone Men Dark Brown Formal Shoes,
27840,Men,Accessories,Belts,Belts,Red,Summer,2013,Casual,Bulchee Men Red Leather Belt,
26992,Women,Apparel,Bottomwear,Jeans,Blue,Summer,2012,Casual,Jealous 21 Women Washed Light Blue Jeans,
31925,Women,Accessories,Bags,Handbags,Red,Summer,2012,Casual,Fabindia Women Red Silk Handbag,
18493,Men,Footwear,Sandal,Sandals,Multi,Fall,2011,Casual,Puma Men Duncan Multi Slipper,
8116,Men,Accessories,Watches,Watches,Navy Blue,Winter,2016,Casual,Fastrack Men Analog Steel Navy Blue Watch,
7962,Men,Apparel,Topwear,Tshirts,Black,Fall,2011,Sports,Puma Men's Graphic Black Red T-shirt,
19541,Men,Accessories,Gloves,Gloves,Black,Fall,2011,Casual,United Colors of Benetton Men Solid Black Gloves,
13847,Women,Apparel,Topwear,Tops,White,Fall,2011,Casual,United Colors of Benetton Women Printed White Top,
16509,Men,Apparel,Bottomwear,Jeans,Blue,Fall,2011,Casual,Locomotive Men Washed Blue Jeans,
12995,Boys,Footwear,Shoes,Casual Shoes,Brown,Fall,2011,Casual,Timberland Kids Boys Brown Casual Shoes,
46279,Women,Apparel,Topwear,Tunics,Blue,Summer,2012,Casual,109F Women Blue & Green Polka Dot Print Tunic,
53599,Men,Free Items,Free Gifts,Free Gifts,Black,Winter,2016,Sports,Q&Q Men Black Digital Watch,
58171,Women,Accessories,Bags,Handbags,Grey,Fall,2012,Casual,Rocky S Women Grey Handbag,
5609,Men,Footwear,Sandal,Sports Sandals,Navy Blue,Spring,2013,Casual,ADIDAS Men Receptor Navy Sports Sandals,
21985,Women,Accessories,Bags,Handbags,Brown,Winter,2015,Casual,Murcia Women Casual Brown bag,
39146,Women,Apparel,Apparel Set,Kurta Sets,Purple,Fall,2012,Ethnic,Aneri Women Purple Ombre Churidar Kurta & Dupatta Set,
57139,Women,Apparel,Bottomwear,Trousers,Black,Summer,2012,Casual,Elle Women Black Etra Slim Fit Trousers,
16951,Men,Accessories,Eyewear,Sunglasses,Black,Winter,2016,Casual,Image Men Classic Eyewear Black Sunglasses,
49655,Women,Apparel,Bottomwear,Skirts,Pink,Summer,2012,Casual,Mineral Pink & Green Skirt,
19125,Women,Footwear,Flip Flops,Flip Flops,Blue,Fall,2011,Casual,Lotto Women XL Kelly Blue Slippers,
48787,Women,Accessories,Jewellery,Pendant,Silver,Summer,2015,Casual,Lu Women Silver Pendant,
17883,Men,Apparel,Innerwear,Innerwear Vests,Navy Blue,Summer,2016,Casual,Levis Men Comfort Style Navy Blue Innerwear Vest,
2048,Men,Apparel,Topwear,Tshirts,Black,Fall,2010,Sports,ADIDAS Men's Crew Black T-shirt,
22358,Men,Apparel,Topwear,Shirts,Beige,Fall,2011,Casual,John Players Men Solid Beige Shirt,
28662,Men,Footwear,Shoes,Casual Shoes,Black,Summer,2012,Casual,Nike Men Lunar Flow Black Casual Shoes,
50778,Men,Footwear,Shoes,Casual Shoes,Navy Blue,Spring,2013,Casual,Clarks Men Navy Leather Sneakers,
2874,Women,Footwear,Shoes,Heels,Black,Winter,2015,Casual,Catswalk Women Black Heels,
33824,Women,Footwear,Shoes,Sports Shoes,Grey,Summer,2012,Sports,Puma Women Grey Axis Sports Shoes,
58515,Women,Apparel,Topwear,Tops,White,Summer,2012,Casual,Tonga Women White Top,
25941,Women,Accessories,Scarves,Scarves,Yellow,Summer,2012,Casual,Femella Women Yellow & Brown Scarf,
45098,Women,Apparel,Innerwear,Briefs,Pink,Summer,2016,Casual,Bwitch Fushia Pink Sapphire Brief,
33018,Women,Apparel,Topwear,Kurtas,Green,Summer,2012,Ethnic,Mother Earth Women Striped Green Kurta,
44976,Men,Accessories,Watches,Watches,Black,Winter,2016,Casual,Maxima Attivo Men Black Dial Watch,
11348,Men,Apparel,Bottomwear,Jeans,Navy Blue,Summer,2017,Casual,Lee Men Navy Blue Powell Fit Jeans,
41438,Men,Footwear,Shoes,Sports Shoes,White,Fall,2012,Casual,Lee Cooper Men White Sports Shoes,
52813,Men,Accessories,Wallets,Wallets,Brown,Summer,2012,Casual,JAG Men Chocolate Brown Leather Wallet,
39522,Unisex,Accessories,Bags,Laptop Bag,Black,Summer,2012,Casual,Peter England Unisex Black Bag,
44378,Men,Personal Care,Fragrance,Perfume and Body Mist,Black,Spring,2017,Casual,ADIDAS Men Dynamic Pulse Perfume,
58727,Women,Apparel,Topwear,Tshirts,Purple,Summer,2012,Casual,Puma Women Purple T-shirt,
14408,Women,Footwear,Shoes,Heels,Beige,Summer,2012,Casual,Enroute Women Casual Beige Flats,
11946,Men,Footwear,Sandal,Sandals,Brown,Summer,2012,Casual,Ganuchi Men Casual Brown Sandals,
36758,Women,Accessories,Watches,Watches,Grey,Winter,2016,Casual,Maxima Women Grey Dial Watch,
5863,Men,Apparel,Topwear,Tshirts,Purple,Summer,2011,Casual,ADIDAS Men's Saltero Purple T-shirt,
39710,Unisex,Accessories,Watches,Watches,Blue,Winter,2016,Casual,ADIDAS Original Unisex Blue Dial Chronograph Watch ADH2639,
19317,Unisex,Accessories,Bags,Backpacks,Black,Spring,2013,Casual,Nike Unisex Casual Black Backpack,
55038,Women,Personal Care,Lips,Lipstick,Brown,Spring,2017,NA,Lakme Absolute Matte Brick Lipstick 51,
8740,Men,Apparel,Topwear,Shirts,Navy Blue,Fall,2011,Casual,Indigo Nation Men Checks Navy Blue Shirt,
23884,Men,Footwear,Shoes,Sports Shoes,White,Fall,2011,Sports,Fila Men Hitech White Sports Shoes,
9692,Men,Apparel,Topwear,Tshirts,Navy Blue,Fall,2011,Casual,Classic Polo Men Ikon Navy Blue Polo Tshirts,
27418,Women,Apparel,Bottomwear,Capris,Red,Winter,2015,Casual,Jockey Women Red Relaxed Capris,
34833,Women,Footwear,Shoes,Flats,Green,Summer,2012,Casual,ADIDAS Women Sweep Green Sandals,
7708,Women,Apparel,Bottomwear,Jeans,Blue,Fall,2011,Casual,Jealous 21 Women Aliah Blue Jegging,
55804,Women,Apparel,Loungewear and Nightwear,Night suits,Multi,Summer,2017,Casual,SDL by Sweet Dreams Women Multicoloured Striped Night Suit S11-3129,
51498,Women,Apparel,Bottomwear,Jeans,Blue,Summer,2012,Casual,Denizen Women Blue Jeans,
29582,Women,Footwear,Shoes,Flats,Black,Summer,2012,Casual,Puma Women Black Grace Flats,
28450,Women,Apparel,Bottomwear,Track Pants,Grey,Summer,2012,Casual,Urban Yoga Women Grey Track Pants,
4710,Unisex,Accessories,Watches,Watches,Black,Winter,2016,Sports,ADIDAS Unisex New York Chronographic Digital Black Red Watch,
15347,Men,Apparel,Topwear,Tshirts,Black,Fall,2011,Sports,Nike Men Special Edition 3 Star Cricket Fan Black Tshirts,
52480,Women,Apparel,Loungewear and Nightwear,Baby Dolls,Blue,Winter,2015,Casual,Red Rose Blue & Black Nightdress,
59068,Women,Apparel,Innerwear,Bra,Blue,Summer,2017,Casual,Peri Peri Women Blue Bra,
21172,Women,Apparel,Topwear,Tunics,Blue,Fall,2011,Casual,s.Oliver Women Powder Blue Tunic,
40979,Boys,Apparel,Topwear,Tshirts,Yellow,Summer,2012,Casual,Gini and Jony Boys Core Yellow T-shirt,
38863,Women,Apparel,Topwear,Tops,Blue,Summer,2012,Casual,Latin Quarters Women Blue Printed Top,
14295,Men,Apparel,Topwear,Tshirts,Black,Fall,2011,Casual,Classic Polo Men Printed pack of 3 Tshirts,
56020,Women,Personal Care,Lips,Lipstick,Purple,Spring,2017,Casual,Colorbar Soft Touch Felin Lipstick 036,
32565,Women,Apparel,Topwear,Tops,Blue,Summer,2012,Casual,ONLY Women Smock Blue Top,
40145,Girls,Apparel,Bottomwear,Capris,Pink,Summer,2012,Casual,Gini and Jony Girls Kinky Pink Capris,
58986,Women,Personal Care,Fragrance,Deodorant,Magenta,Spring,2017,Casual,Cavallini Womens Deo,
24400,Women,Apparel,Topwear,Kurtas,Black,Summer,2012,Ethnic,Vishudh Women Black Printed Kurta,
10635,Men,Footwear,Shoes,Casual Shoes,Black,Fall,2011,Casual,Carlton London Men Semi oxfords Black Casual Shoes,
18458,Men,Personal Care,Fragrance,Deodorant,White,Spring,2017,Casual,David Beckham Instinct Men Deos,
27285,Women,Apparel,Topwear,Kurtas,Brown,Fall,2011,Ethnic,Mother Earth Women Brown Kurta,
48328,Women,Accessories,Bags,Handbags,Pink,Summer,2012,Casual,Pitaraa Women Pink Sling Bag,
42612,Women,Accessories,Jewellery,Jewellery Set,Gold,Winter,2016,Casual,Estelle Women Gold Earring & Pendant Set,
3535,Men,Apparel,Topwear,Tshirts,Navy Blue,Summer,2011,Casual,Myntra Men's Saadhu Starter Kit Navy Blue T-shirt,
26357,Women,Apparel,Topwear,Tshirts,Pink,Summer,2012,Casual,Arrow Woman Striped Pink T-shirt,
12162,Women,Apparel,Bottomwear,Leggings,Green,Fall,2011,Ethnic,Aurelia Women Solid Blue Leggings,
47360,Women,Accessories,Bags,Handbags,Green,Summer,2012,Casual,Baggit Women Green Bag,
9833,Women,Apparel,Topwear,Tshirts,Green,Fall,2011,Casual,Little Miss Women Printed Olive Green T-shirt,
17410,Men,Footwear,Shoes,Sports Shoes,White,Fall,2011,Sports,Lotto Men Atlantica White Sports Shoe,
23625,Girls,Apparel,Topwear,Tops,Pink,Fall,2011,Casual,Doodle Kids Girls Pink Retro Top,
51205,Women,Apparel,Innerwear,Bra,Skin,Summer,2017,Casual,Enamor Women Skin Bra,
7195,Women,Apparel,Topwear,Tops,White,Fall,2011,Casual,Jealous 21 Women Knit Butterfly Print White Top,
30000,Women,Accessories,Watches,Watches,Silver,Winter,2016,Casual,Aspen Women Silver Dial Watch,
13282,Women,Apparel,Bottomwear,Capris,Black,Fall,2011,Casual,Gini and Jony Kids Solid Black Capris,
54545,Women,Accessories,Bags,Handbags,Orange,Summer,2012,Casual,Lino Perros Women Orange Handbag,
55497,Women,Personal Care,Lips,Lip Gloss,Pink,Spring,2017,Casual,Revlon Peony Pivoine Lip Gloss 008,
12350,Men,Apparel,Topwear,Shirts,Pink,Fall,2011,Formal,Reid & Taylor Men Pink Striped Shirt,
29911,Men,Accessories,Watches,Watches,Black,Winter,2016,Casual,Police Men Black Dial Watch PL12176JS02A,
3707,Men,Apparel,Topwear,Tshirts,Purple,Summer,2011,Casual,Classic Polo Men's Purple Black & Cream Stripe T-shirt,
6275,Women,Apparel,Topwear,Tshirts,Pink,Summer,2011,Casual,UCB Women's Crystal Benetton Pink T-shirt,
26959,Women,Apparel,Topwear,Shirts,Pink,Summer,2012,Casual,Jealous 21 Women Pink Shirt,
46080,Men,Footwear,Shoes,Sports Shoes,Blue,Summer,2012,Sports,ADIDAS Men Blue Sports Shoes,
51037,Women,Apparel,Innerwear,Briefs,White,Summer,2017,Casual,Enamor Women White and Pink Briefs,
21340,Men,Accessories,Eyewear,Sunglasses,Copper,Winter,2016,Casual,Pal Zileri Men Casual Copper Frame Sunglasses,
4522,Men,Footwear,Shoes,Sports Shoes,Grey,Summer,2011,Sports,Puma Men's Faas Grey Shoes,
45605,Men,Footwear,Shoes,Formal Shoes,Black,Summer,2013,Formal,Arrow woMen Black Formal Shoes,
37225,Men,Accessories,Bags,Duffel Bag,Olive,Summer,2012,Casual,United Colors of Benetton Men Olive Duffle Bag,
53760,Men,Apparel,Topwear,Tshirts,Navy Blue,Summer,2012,Casual,Puma Men Navy Blue and White T-shirt,
15949,Men,Accessories,Ties,Ties,Black,Fall,2011,Formal,Turtle Men Check Black Ties,
32757,Men,Footwear,Shoes,Casual Shoes,Multi,Fall,2012,Casual,Fila Men Glam II Multi Coloured Shoes,
56212,Women,Accessories,Jewellery,Pendant,Gold,Winter,2016,Casual,Estelle Women Gold Pendant with Chain,
24632,Unisex,Footwear,Flip Flops,Flip Flops,Red,Fall,2011,Casual,ADIDAS Unisex Red Checks Flip Flops,
10407,Men,Apparel,Topwear,Shirts,Grey,Fall,2011,Formal,United Colors of Benetton Men Solid Grey Shirts,
33685,Men,Footwear,Shoes,Formal Shoes,Black,Summer,2012,Formal,Cobblerz Men Black Formal Shoes,
12734,Women,Accessories,Bags,Handbags,Black,Fall,2011,Sports,Nike Women Samba Black Handbags,
42044,Men,Footwear,Shoes,Casual Shoes,Grey,Summer,2012,Casual,Nike Men Wardour Chukka White Casual Shoes,
3363,Women,Apparel,Topwear,Tshirts,Black,Summer,2011,Casual,Myntra Women Creative designs Black T-shirt,
9659,Men,Apparel,Topwear,Shirts,Blue,Fall,2011,Casual,Indigo Nation Men Reversible Bling Blue Shirts,
30464,Women,Apparel,Innerwear,Bra,White,Summer,2014,Casual,Lovable Women All Day Long White Bra,
43196,Women,Accessories,Watches,Watches,White,Winter,2016,Casual,Fastrack Women White Dial Watch,
54121,Women,Footwear,Shoes,Heels,Black,Winter,2012,Casual,Fastrack Women White Dial Watch,
